{
  "$schema": "https://json-schema.org/draft/2020-12/schema",
  "$id": "https://specs.actprotocol.org/schemas/psd/delegation-agreement-query.schema.json",
  "title": "Delegation Agreement Query (PSD-PAY-DEL-QUERY)",
  "description": "ACT 协议委托协议查询（PSD-PAY-DEL-QUERY）的 JSON Schema 定义。用于查询已签约委托协议的状态与详情。",
  "type": "object",
  "required": [
    "request_id",
    "timestamp"
  ],
  "properties": {
    "request_id": {
      "type": "string",
      "description": "请求全局唯一标识，用于防重放"
    },
    "agreement_no": {
      "type": "string",
      "description": "委托协议号，与 external_agreement_no 二选一"
    },
    "external_agreement_no": {
      "type": "string",
      "description": "外部协议号，与 agreement_no 二选一"
    },
    "principal_id": {
      "type": "string",
      "description": "委托人身份标识（DID），用于按委托人维度查询"
    },
    "agent_id": {
      "type": "string",
      "description": "受托智能体身份标识（DID），用于按智能体维度查询"
    },
    "personal_product_code": {
      "type": "string",
      "description": "签约产品码，用于按产品维度筛选"
    },
    "timestamp": {
      "type": "string",
      "format": "date-time",
      "description": "请求时间戳（ISO 8601 UTC）"
    },
    "signature": {
      "type": "string",
      "description": "请求方对关键要素的签名"
    },
    "signature_algorithm": {
      "type": "string",
      "description": "签名算法标识"
    }
  },
  "oneOf": [
    { "required": ["agreement_no"] },
    { "required": ["external_agreement_no"] },
    { "required": ["principal_id", "agent_id"] }
  ]
}
